,url,date,content,outlinks,linkPreview
282,https://t.me/s/ru_pythonjobs/24531,2024-06-07 12:46:09+00:00,"#вакансия #job #работа #python #Django #postgresql #remote #удаленка #seniorMiddle/Senior Python Developer💻 Формат работы: full-time🌍  Локация: удаленка 💵  ЗП: 3000-4500$ 📱 Для быстрой связи: @trueaivazПрисоединяйтесь к нашей инновационной финтех компании Fingular и станьте частью масштабного проекта по развитию онлайн-банка в Юго-Восточной Азии!🔧Стек проекта:База данных: postgresОчередь: кафкаИнфрастуктура: docker, kubernetes, gitlabОбязанности: • Проектирование и разработка сервисов. • Контроль качества кода, проведение code-review. • Оценка задач и участие в планировании работ. • Участие в разработке архитектуры приложения.Требования: • Высшее техническое образование. • Опыт работы разработчиком от 5 лет. • Отличное знание Python и PostgreSQL. • Умение писать запросы не только через ORM. • Опыт проектирования и реализации API для веб и мобильных приложений.Будет плюсом: • Опыт создания высоконагруженных систем и сервисов. • Работа с облачными сервисами: AWS / Yandex.Cloud / Azure / Alibaba Cloud. • Опыт с контейнеризацией (Docker, Docker Compose, Kubernetes). • Опыт в fintech. • Хороший разговорный английский.Мы предлагаем: • Удаленную работу. • Профессиональную команду, которой мы гордимся. • Адекватность руководства и демократичность процесса разработки. • Возможность влиять на проект и вносить свои предложения. Гибкий рабочий график для оптимального баланса между работой и личной жизнью.Контакты: @trueaivaz Буду рада ответить на ваши вопросы 🙃","['https://t.me/s/ru_pythonjobs?q=%23%D0%B2%D0%B0%D0%BA%D0%B0%D0%BD%D1%81%D0%B8%D1%8F', 'https://t.me/s/ru_pythonjobs?q=%23job', 'https://t.me/s/ru_pythonjobs?q=%23%D1%80%D0%B0%D0%B1%D0%BE%D1%82%D0%B0', 'https://t.me/s/ru_pythonjobs?q=%23python', 'https://t.me/s/ru_pythonjobs?q=%23Django', 'https://t.me/s/ru_pythonjobs?q=%23postgresql', 'https://t.me/s/ru_pythonjobs?q=%23remote', 'https://t.me/s/ru_pythonjobs?q=%23%D1%83%D0%B4%D0%B0%D0%BB%D0%B5%D0%BD%D0%BA%D0%B0', 'https://t.me/s/ru_pythonjobs?q=%23senior', 'https://t.me/trueaivaz']",
283,https://t.me/s/ru_pythonjobs/24530,2024-06-07 09:34:59+00:00,"#Python #вакансия #job #работа Вакансия: Ревьюер студентов Backend-разработки, Middle ++Компания: Учебный проект;Уровень зп: за данный проект оплаты не будет, он тестовый, последующие проекты оплачиваются от кол-ва студентов;Формат: удаленка, UTS +3;Локация: Россия, Москва;Занятость: 2-6 часов в неделю;Опыт работы:  3 + года;Стек:Python;Работа с API;Postgre SQL;Чем предстоит заниматься:В данном проекты мы делаем тг бота.Участие в выборе решения, проектирование сервиса, вычитка и ревью кода студентов, ответы на вопросы студентов в рамках проекта.Необходимые навыки:Опыт разработки на Python, наставничество;Условия:Удаленка;2-6 часов в неделю;Уровень зп: данный проект является тестовым и не оплачивается, последующие проекты оплачиваются исходя из кол-ва студентов.Резюме и вопросы в личкуКонтакты:По всем вопросам пишите в Telegram @talarion","['https://t.me/s/ru_pythonjobs?q=%23Python', 'https://t.me/s/ru_pythonjobs?q=%23%D0%B2%D0%B0%D0%BA%D0%B0%D0%BD%D1%81%D0%B8%D1%8F', 'https://t.me/s/ru_pythonjobs?q=%23job', 'https://t.me/s/ru_pythonjobs?q=%23%D1%80%D0%B0%D0%B1%D0%BE%D1%82%D0%B0', 'https://t.me/talarion']",
284,https://t.me/s/ru_pythonjobs/24528,2024-06-06 11:18:55+00:00,"Мы — команда ForUMarket, амбициозного стартапа, создающего инновационную e-commerce платформу. В поисках талантливого backend Python разработчика, который присоединится к нашей команде и поможет нам реализовать наши смелые идеи.Обязанности:— Разработка и поддержка серверной части платформы на Python;— Работа с базами данных;— Создание API для взаимодействия с внешними сервисами;— Обеспечение высокой доступности и производительности системы;— Участие в принятии технических решений и планировании разработки;Требования:— Отличное знание Python (Можно без коммерческого опыта);— Опыт работы с фреймворком FastApi;— Понимание принципов работы HTTP, RESTful API;— Знание алгоритмов и структур данных;— Умение оптимизировать запросы к базе данных;— Опыт работы с системами контроля версий (Git);Будет плюсом:— Опыт работы с облачными платформами (AWS, Google Cloud, Azure);— Знание Linux;— Знание Docker и Kubernetes;— Опыт работы с NoSQL базами данных;Мы предлагаем:— Работу над интересным проектом в сфере e-commerce;— Дружелюбную команду, готовых делиться опытом;— Гибкий график, удаленная работа;— Проектная работа с заключением официального контракта (После завершения проекта предлагаем официальное трудоустройство);—Вознаграждение за разработку проекта обсуждается индивидуально;— Возможность карьерного роста и профессионального развития;Если вы готовы принять этот вызов и стать частью нашей команды, мы ждем ваше резюме и сопроводительное письмо. Контакт для связи: telegram - @twotruezart",['https://t.me/twotruezart'],
285,https://t.me/s/ru_pythonjobs/24526,2024-06-06 09:05:51+00:00,"Оставить чаевые ☕️Спасибо, что следите за моим каналом! 🎉 Я рад делиться  вакансиями для Python разработчиков и всегда буду делать это бесплатно. Никакой рекламы – только свежие и актуальные предложения.Если вам нравится то, что я делаю, вы можете оставить чаевые ☕️Спасибо вам за подписку и интерес к каналу! ❤️",['https://t.me/tribute/app?startapp=donation_13345'],
286,https://t.me/s/ru_pythonjobs/24525,2024-06-06 06:40:56+00:00,"#вакансия #работа #Python #Senior #developer #Remote #work #job #работа #Game #Европа #Грузия #Армения #Литва #Poland #Латвия #Bulgaria #Georgia #Moldova #СНГ #Cyprus #Кипр #Spain #fulltime 🐍Senior Python developer (outside Russia)         Salary range: 3000 - 4500 USD gross                                                                                                                                                                                                                                    Remote work, full time                                                                                                                                                                                                                   Project: Game                                                                                                                                                                                                                                     Company: KA RedCode                                                                                                                                                                                                                                         Responsibilities: support core BackEnd team working on MMO game•  Develop and implement meta gameplay features within meta server•  Develop and implement auto-tests covering meta features•  Design and implement APIs and protocols that are consistent, formalized, and testable.•  Write clear, maintainable, portable, and highly functional code.•  Ensure stability of several backend services.•  Investigate and response to issues arising in the live environment.•  Integrate solution with third-party engines and platforms.•  Maintain and keep the system documentation updated. Qualifications:•  3+ years of Python programming.•  3+ years of experience in server software development.•  Experience with developing asynchronous/multithreaded applications.•  Familiarity with databases and message brokers.•  Experience of working with distributed systems.•  Experience with load testing, troubleshooting, and optimizing performance of server services. Additional skills:•  Experience with or willingness to learn Rust•  Experience with C++•  Game development experience•  Familiarity with Linux, Docker, Kubernetes•  Familiarity with Actor model frameworks (Akka, CAF, Orleans, Actix etc.)We offer:                                                                                                                                                                                                                                            Work remotely                                                                                                                                                                                                                                               Contract work                                                                                                                                                                                                                         Interesting and complex projects                                                                                                                                                                                                       In the future there is the possibility of relocation to an office in Lithuania😊Contact: @TatiSolar","['https://t.me/s/ru_pythonjobs?q=%23%D0%B2%D0%B0%D0%BA%D0%B0%D0%BD%D1%81%D0%B8%D1%8F', 'https://t.me/s/ru_pythonjobs?q=%23%D1%80%D0%B0%D0%B1%D0%BE%D1%82%D0%B0', 'https://t.me/s/ru_pythonjobs?q=%23Python', 'https://t.me/s/ru_pythonjobs?q=%23Senior', 'https://t.me/s/ru_pythonjobs?q=%23developer', 'https://t.me/s/ru_pythonjobs?q=%23Remote', 'https://t.me/s/ru_pythonjobs?q=%23work', 'https://t.me/s/ru_pythonjobs?q=%23job', 'https://t.me/s/ru_pythonjobs?q=%23Game', 'https://t.me/s/ru_pythonjobs?q=%23%D0%95%D0%B2%D1%80%D0%BE%D0%BF%D0%B0', 'https://t.me/s/ru_pythonjobs?q=%23%D0%93%D1%80%D1%83%D0%B7%D0%B8%D1%8F', 'https://t.me/s/ru_pythonjobs?q=%23%D0%90%D1%80%D0%BC%D0%B5%D0%BD%D0%B8%D1%8F', 'https://t.me/s/ru_pythonjobs?q=%23%D0%9B%D0%B8%D1%82%D0%B2%D0%B0', 'https://t.me/s/ru_pythonjobs?q=%23Poland', 'https://t.me/s/ru_pythonjobs?q=%23%D0%9B%D0%B0%D1%82%D0%B2%D0%B8%D1%8F', 'https://t.me/s/ru_pythonjobs?q=%23Bulgaria', 'https://t.me/s/ru_pythonjobs?q=%23Georgia', 'https://t.me/s/ru_pythonjobs?q=%23Moldova', 'https://t.me/s/ru_pythonjobs?q=%23%D0%A1%D0%9D%D0%93', 'https://t.me/s/ru_pythonjobs?q=%23Cyprus', 'https://t.me/s/ru_pythonjobs?q=%23%D0%9A%D0%B8%D0%BF%D1%80', 'https://t.me/s/ru_pythonjobs?q=%23Spain', 'https://t.me/s/ru_pythonjobs?q=%23fulltime', 'https://t.me/TatiSolar']",
287,https://t.me/s/ru_pythonjobs/24524,2024-06-06 06:40:28+00:00,"#удаленка #python #вакансия #работа #senior #полнаязанятость #job #django Всем привет! Компания ""Brief"" в поисках Python разработчика (Middle+)🙋 Мы предлагаем: Занятость: full-timeФормат работы: удаленныйТрудоустройство: ТК РФ, ИП, ГПХ, СамозанятостьЛокация: РФЗарплатная вилка: от 230 000 рублейСрок занятости на проекте: от года🧑‍💻О проекте:Наш проект это - комплексная автоматизированная система сбора, передачи, обработки, хранения и распространения аэронавигационной информации.В настоящее время система поэтапно вводится в опытную эксплуатацию, на каждом этапе включаются новые организации-участники процесса разработки и согласования аэронавигационной информации.Стэк: Python3, Django, DjangoRestFrameworkОграничение по локации: отсутствует 💁‍♂️Требования:• Опыт разработки на Python3;• Знание HTTP протокола• Опыт работы с фреймворками Django и DjangoRestFramework от 2 лет;• Базовые знания HTML/CSS;• Понимание работы асинхронных приложений;• Знание SQL, опыт работы с реляционными базами данных (PostgreSQL), умение использовать ORM (например, Django ORM)• Опыт разработки сервисов;• Опыт интеграции со сторонними сервисами и API;• Опыт работы с Linux bash(Ubuntu, Debian);• Опыт работы с системами контроля версий Git;• Понимание CI/CD• Уметь профайлить и оптимизировать• Желание и умение проводить code review;• Привычка качественно документировать код и apiПодробности и больше информации можно узнать:TG @slvbrief💻","['https://t.me/s/ru_pythonjobs?q=%23%D1%83%D0%B4%D0%B0%D0%BB%D0%B5%D0%BD%D0%BA%D0%B0', 'https://t.me/s/ru_pythonjobs?q=%23python', 'https://t.me/s/ru_pythonjobs?q=%23%D0%B2%D0%B0%D0%BA%D0%B0%D0%BD%D1%81%D0%B8%D1%8F', 'https://t.me/s/ru_pythonjobs?q=%23%D1%80%D0%B0%D0%B1%D0%BE%D1%82%D0%B0', 'https://t.me/s/ru_pythonjobs?q=%23senior', 'https://t.me/s/ru_pythonjobs?q=%23%D0%BF%D0%BE%D0%BB%D0%BD%D0%B0%D1%8F%D0%B7%D0%B0%D0%BD%D1%8F%D1%82%D0%BE%D1%81%D1%82%D1%8C', 'https://t.me/s/ru_pythonjobs?q=%23job', 'https://t.me/s/ru_pythonjobs?q=%23django', 'https://t.me/slvbrief']",
288,https://t.me/s/runello_rus_python/716,2024-06-20 17:00:45+00:00,"Объединились с каналами в общую папку, чтобы ваша карьера поднималась только вверх 🔝! Нужно только нажать на ссылку и добавить папку себе, чтобы получать полезную информацию, лайфхаки и много вакансий. Работа мечты ближе с нами). Успейте добавить👇https://t.me/addlist/fo9ZHEm5rfc0ODIy",['https://t.me/addlist/fo9ZHEm5rfc0ODIy'],
289,https://t.me/s/runello_rus_python/715,2024-06-20 12:00:00+00:00,"Python Team Lead в General BillingVKЭто более 200 технологичных проектов, больше 11 000 сотрудников и миллион возможностей проявить себя. Мы делаем современные и быстрые интернет-сервисы, доступные каждому.Обязанности:• Управление монофункциональной командой backend-разработки Python и чутка Go;• Мотивация и развитие команды;• Целеполагание (OKR/KPI) и контроль за достижением целей;• Кросс-командные взаимодействия (Front/QA/DevOps/SRE/Architects);• Обеспечение контроля качества разработки продукта;• Участие вместе с командой в продуктовой проработке;• Планирование и распределение задач;• Анализ рисков, связанных с разработкой, и принятие мер по их минимизации.Требования• Техническое лидерство: умение руководить и направлять разработчиков, предоставляя техническое руководство и поддержку;• Отличное знание Python 3 и верхнеуровневое понимание Go, включая ключевые особенности, языки программирования, фреймворки и best practices;• Знание Postgres: отличные навыки работы с данными, понимание принципов Data Governance;• Архитектурное/системное мышление: способность разрабатывать архитектурные концепции и решения, выдерживающие высокие нагрузки; навыки описания процессов (BPMN 2.0) и диаграмм взаимодействия систем (C4/UML);• Управление проектами: навыки планирования, управления проектами и ресурсами, создание графиков, установление приоритетов и обеспечение соблюдения сроков;• Коммуникация и коллаборация: умение эффективно общаться и сотрудничать с разработчиками, менеджментом, заказчиками и другими заинтересованными сторонами;• Лидерство и мотивация: умение вдохновлять команду, обеспечивать мотивацию, развивать и повышать навыки сотрудников;Будет плюсом• Опыт разработки на языках со строгой типизацией (C++/C#/Java/Rust);• Опыт решения задач BigData и навыки работы с ETL/Data Streaming;• Опыт работы с MQ Kafka/Redis/Rabbit.Откликнуться: Ссылка для откликаБольше вакансий для Python - разработчиков в","['https://team.vk.company/', 'https://team.vk.company/vacancy/37950/']",
290,https://t.me/s/runello_rus_python/714,2024-06-19 12:00:00+00:00,"Teach Lead python developerСберКрупнейшая цифровая платформа. Технобренд, объединяющий лучшие мировые практики и самый современный стекОбязанности• Проектировать и разрабатывать backend-части проектов.• Взаимодействовать с разработчиками (бек и фронт), DS, системным аналитиком, дизайнером.• Заниматься наставничеством в команде.Что мы используем:• Python 3, Django, aiohttp• Neo4j, PostgreSQL, MongoDB• Docker, Jenkins, OpenShift, Linux, Bash, Git• Готовы к предложениям использовать и другие технологииТребования:• Ты хочешь заниматься сложными и интересными задачами.• Тебе придется не просто пилить Web-сервисы, а еще разобраться с графами, онтологиями и алгоритмами.• Ты силен в System Design. • Мы внедряем наши ML-разработки, при этом думая о конечном пользователе.• Ты хорошо знаком с алгоритмами и готов рассказать, как лучше обойти дерево.  Результат нашего извлечения из документа – граф сущностей. На основе этих данных мы строим онтологии и предоставляем возможность поиска по ним.• Ты командный игрок: готов слушать, предлагать и брать ответственность. У нас сильная команда, где каждый может повлиять на итоговое решение.• Ты нацелен на результат. Наша цель – делать продукты ценные для пользователя на основе ML-решений и доказывать это продажами.Условия работы• Работа среди сильных специалистов в своей области. В нашей команде работают выпускники МФТИ, МГУ, ВШЭ, МГЮА•  Возможности саморазвития: оплата поездок на конференции, прохождение курсов, спортзал.• Гибкий график работы и возможность работать удаленно.• ДМС для сотрудника и его родственников.• Льготная ипотека в Сбере• Незабываемый опыт. Это мы тебе гарантируемОткликнуться: Ссылка для откликаБольше вакансий для Python - разработчиков в канале Data Science & Engineering Job Offers","['http://sber.ru/', 'https://rabota.sber.ru/search/4304753/', 'https://t.me/runello_rus_datascience']",
