,url,date,content,outlinks,linkPreview
401,https://t.me/s/GameDev_and_Tech_vacancy/653,2024-06-20 08:01:02+00:00,"Senior Game Designer (Arcade Idle/ARPG)Location:Remote (open to candidates from Eastern Europe and MENA regions)About Noor Games Founded in 2015, Noor Games quickly became one of the world’s leading studios in producing hyper-casual games. We are honored to be recognized as pioneers of the Arcade Idle genre with the creation of Lumbercraft.4 hit titles, namely Lumbercraft and Basket Battle hitting #1 on the App Store and Google Play, over 100M downloads, millions of captivated and delighted players – this is what Noor Games has achieved.We are on a mission to create even more delightful games for our players, and we’re looking for a talented Senior Game Designer to join our dynamic team.Work conditionsFull timeRemoteMust be fluent in English or Armenian80% overlap with the Armenian time zone (GMT+4) for meetings and collaborationKey ResponsibilitiesDesign and develop Arcade Idle games with ARPG elementsCreate and balance game systems (progression, rewards, monetization)Collaborate with the team to implement and refine game mechanicsDefine content for core and meta game aspectsPrototype and iterate based on feedback and dataPlaytest and ensure features are fun, understandable, and enjoyable for playersRequired Skills5+ years of experience in game design, focusing on Idle / Arcade Idle / ARPG gamesStrong experience on game mechanics, balance, and player progressionProficiency with spreadsheets (Excel, Google Sheets) and school math skillsKnowledge of design principles and player psychologyPreferred SkillsBasic skills in Unity EditorUnderstanding of statistics and analyticsWhat We OfferFlexible remote work environmentOpportunities for growth and developmentCollaborative and creative team cultureCompetitive salaryTo applySubmit your resume, cover letter, and portfolio to  design@noorgames.com address by July 10, 2024Join Noor Games and be part of a team that values creativity and aims to bring joy to millions of players worldwide. @Kmatinyan","['https://noorgames.com/', 'https://t.me/Kmatinyan']","{'href': 'https://noorgames.com/', 'siteName': 'Noorgames', 'title': 'Game Design and Development – Official website of Noor Games', 'description': 'Noor Games is a hyper casual game development studio.', 'image': None}"
402,https://t.me/s/GameDev_and_Tech_vacancy/652,2024-06-19 12:02:28+00:00,"🔥Epic Games is hiring!🔥I wanted to share some production roles we're looking to fill! Please take a look and if you are interested and meet the requirements, apply directly! Art Producer - Gameplay Concept https://lnkd.in/guNMZ98PConcept Producer - https://lnkd.in/geRWMzSgTechnical Producer - https://lnkd.in/g_Kq3HkuSenior Producer - https://lnkd.in/gHy356TSLead Producer - https://lnkd.in/ggWCZrVh To take a look at all of our roles we're currently hiring for around the world, please visit: https://lnkd.in/gHdU4QdY#production #producing #gameproduction #nowhiring","['https://www.linkedin.com/company/epic-games/', 'https://lnkd.in/guNMZ98P', 'https://lnkd.in/geRWMzSg', 'https://lnkd.in/g_Kq3Hku', 'https://lnkd.in/gHy356TS', 'https://lnkd.in/ggWCZrVh', 'https://lnkd.in/gHdU4QdY', 'https://t.me/s/GameDev_and_Tech_vacancy?q=%23production', 'https://t.me/s/GameDev_and_Tech_vacancy?q=%23producing', 'https://t.me/s/GameDev_and_Tech_vacancy?q=%23gameproduction', 'https://t.me/s/GameDev_and_Tech_vacancy?q=%23nowhiring']","{'href': 'https://www.linkedin.com/company/epic-games/', 'siteName': 'Linkedin', 'title': 'Epic Games | LinkedIn', 'description': 'Epic Games | 732,377 followers on LinkedIn. Founded in 1991, Epic Games is a leading interactive entertainment company and provider of 3D engine technology. Epic operates Fortnite, one of the world’s largest games with over 350 million accounts and 2.5 billion…', 'image': None}"
403,https://t.me/s/GameDev_and_Tech_vacancy/651,2024-06-19 10:38:44+00:00,"Друзья! VIZOR в поиске талантливого 🌟 Creative Producer (Playable Ads)🌟, который бы смог усилить и без того сильную команду!)Чем предстоит заниматься 👩🏻‍💻: - Разработка концепций мини-игр для рекламы игровых проектов. - Написание сюжетов, механик и логики прохождения мини-игр. - Оценка результатов тестирования и формирование выводов. -Оптимизация процессов репортинга перформанса плееблов и др.Подробности здесь 👉🏻 : https://lnkd.in/eTjw2hNyБуду рада рассказать о нас и обсудить возможные варианты сотрудничества 🤗 📩 DM | tg: @katarjin#PlayableAds #GameDev #CreativeProducer #MobileGames #vacancy","['https://lnkd.in/eTjw2hNy', 'https://t.me/katarjin', 'https://t.me/s/GameDev_and_Tech_vacancy?q=%23PlayableAds', 'https://t.me/s/GameDev_and_Tech_vacancy?q=%23GameDev', 'https://t.me/s/GameDev_and_Tech_vacancy?q=%23CreativeProducer', 'https://t.me/s/GameDev_and_Tech_vacancy?q=%23MobileGames', 'https://t.me/s/GameDev_and_Tech_vacancy?q=%23vacancy']",
404,https://t.me/s/GameDev_and_Tech_vacancy/650,2024-06-19 08:41:05+00:00,"Привет, мы команда Hue Axis, разработчики нашумевшей “Русы не против Ящерок”. В данный момент мы ищем писателя-сценариста на проектную занятость для работы над новыми частями серии. Требования: - Опыт в написании сценариев и игровых текстов- Грамотный русский язык- Чувство юмора- Умение писать стилизованный старославянский текст- Умение разбираться в поп-культуре, мемах и отсылкахОплата обсуждается с каждым кандидатом отдельно.Резюме или примеры работ присылайте на lana@hueaxis.comВозможно, будет предложено сделать тестовое задание.",['https://store.steampowered.com/agecheck/app/2715650/'],"{'href': 'https://store.steampowered.com/agecheck/app/2715650/', 'siteName': 'Steampowered', 'title': 'Site Error', 'description': None, 'image': 'https://cdn4.cdn-telegram.org/file/TbkeyNZ9K73nNv7yFg7CWgnSbVphIT9bBT_0dD-3I9XtFRZgUTPg8UaGdEdCuFYy7bJjDQKqLvNyBO8Y42hfiA9cSwlxjX9mnor2F2HdQ6uzaqr9buquHy5RF2nbjEBFlmbCUAg4ibr_zVNXgxeqhPmB8I3hSpyEywNa8N_9CrvUGMANV15IJ7TkFf9tVQXaiZnoyk6QC0lqu8qPieYSqdVYaawRYZG54VNJTroc_tbOBYC63QC75idR58j1mI0iU_PBiGceK4OmOnwDcGX4neI1Wt2cv2cUJCsDhRaXAOud7aOtwFBsIgr6akTjX9pcqSBojD2sjD24dzpj7pqSPg.jpg'}"
405,https://t.me/s/GameDev_and_Tech_vacancy/649,2024-06-18 15:54:40+00:00,"#vacancy #вакансия #unity #gamedev #fulltime #remote🔎 Ищем Senior unity developer 🔍📍 УДАЛЕННО_________💰ЗП: 3 – 3,5К евро на рукиКомпания: RecruitIT📍На данный момент ищем Senior unity developer в команду популярного издателя высококачественных стратегий. Ребята разрабатывают и публикуют игры на ПК, мобайл и консоли.Общее количество пользователей превышает 1 миллиард.💡 Чем предстоит заниматься: * Разработкой кода на мобайл на C# с использованием Unity;☑️ Наш идеальный напарник:* работал на мидкор/харкор играми, АА, ААА;* знаешь С# на уверенном уровне, принципы ООП;* имеешь опыт разработки приложений на мобайл.🔥Взамен приготовили для вас:* высокая зарплата со старта;* официальное оформление;* гибкий график, удаленный формат работы;* компенсация обучения, профильные конференции и тренинги;* сильная команда, неформальная рабочая атмосфера.______________________Обсудим?) @ResearcherRIT","['https://t.me/s/GameDev_and_Tech_vacancy?q=%23vacancy', 'https://t.me/s/GameDev_and_Tech_vacancy?q=%23%D0%B2%D0%B0%D0%BA%D0%B0%D0%BD%D1%81%D0%B8%D1%8F', 'https://t.me/s/GameDev_and_Tech_vacancy?q=%23unity', 'https://t.me/s/GameDev_and_Tech_vacancy?q=%23gamedev', 'https://t.me/s/GameDev_and_Tech_vacancy?q=%23fulltime', 'https://t.me/s/GameDev_and_Tech_vacancy?q=%23remote', 'https://recruitit.ru/', 'https://t.me/ResearcherRIT']","{'href': 'https://recruitit.ru/', 'siteName': 'recruitit.ru', 'title': 'HR-агентство по подбору\xa0digital и ИТ специалистов', 'description': 'RecruitIT (РекрутИТ) – IT-кадровое агентство. Подбор it-персонала. Подберем любых специалистов для российских и международных it-компаний.', 'image': None}"
406,https://t.me/s/GameDev_and_Tech_vacancy/648,2024-06-18 10:02:51+00:00,"Привет!Мы - игровая студия AIGRIND, уже 16 лет мы создаём мобильные MMORPG. У нас 85+ сотрудников, и два проекта - Warspear Online (15 лет в релизе) и Skylore (1,5 года в релизе).Сейчас мы приглашаем в команду Warspear Online опытного UI/UX дизайнера с интересом к работе над игровым интерфейсом сложного MMO проекта.Нашему новому коллеге мы предложим отвечать за выстраивание процессов и стать оунером UX/UI дизайна.Задачи:- анализ и проектирование пользовательских сценариев;- макетирование и прототипирование интерфейсов под игровые проекты на iOS и Android. 90% - разработка интерфейса игры, 10% - веб-дизайн и промо материалы;- сопровождение и контроль качества интерфейса на этапах отрисовки, интеграции, внутреннего и внешнего тестирования;- систематизация созданного интерфейса в дизайн-фреймворки (UI Kit) и его поддержка;- взаимодействие с программистами, геймдизайнерами и арт-командой для синхронизации работы по UI-направлению;- написание и поддержка в актуальном состоянии UX-документации.Требования:- опыт в разработке UI/UX-дизайна (желательно мобильных игровых проектов);- знание гайдлайнов Human Interface и Material Design;- владение инструментами растровой и векторной графики (основная связка Figma и Photoshop);- уверенные навыки работы с типографикой, вёрсткой, композицией, модульными сетками;- понимание особенностей разработки под различные платформы и устройства;навыки вёрстки адаптивного веб-дизайна;- знание английского на уровне чтения технической литературы.Мы предлагаем:- работу над уникальным проектом в профессиональной команде;- возможность влиять на проект и выстраивать работу по своему профессиональному видению;- удаленку, офис в центре Калининграда или гибридный формат работы - по желанию;- финансовые условия, которые будут полностью устраивать (предлагаем обсуждать индивидуально);- конечно, официальное трудоустройство (Россия, Армения, Черногория) и ДМС.Будем очень рады знакомству! @kristel_ts","['https://warspear-online.com/ru/', 'https://t.me/kristel_ts']","{'href': 'https://warspear-online.com/ru/', 'siteName': 'Warspear-Online', 'title': 'Warspear Online', 'description': None, 'image': None}"
407,https://t.me/s/GameDev_and_Tech_vacancy/647,2024-06-18 08:01:01+00:00,"Dear all,My partner is a leading provider of game and web outsourcing services in Thailand, serving clients globally. They specialize in delivering high-quality solutions in the gaming and web development industry. With a diverse team of talented professionals, they are committed to excellence and innovation.Now we are looking for the following professionals to relocate and work in Bangkok, Thailand with a rather good compensation package and working conditions. 🔰 If you are interested, please send your CVs to safma87@gmail.com (I am a freelance recruiter) 🔹 Technical Director (JD Link https://shorturl.at/YTYNR)🔸 Business Analyst (JD Link https://shorturl.at/goNSe)🔹 Chief product officer (JD Link https://shorturl.at/kVUUI)🔸 Scrum Master/Project Manager (JD Link https://shorturl.at/jmHIh) 🔹 Product Designer (JD Link https://rb.gy/ral34i) ⏩⏩ The company provides.Work permit, visa granted2 months' salary bonus (after 1 year)12 days Annual LeavesFlexible benefit packageEmployee Referral Program🔆 p.s. Relocation and living costs are negotiable.","['https://www.linkedin.com/company/gattaca-asia/', 'https://shorturl.at/YTYNR', 'https://shorturl.at/goNSe', 'https://shorturl.at/kVUUI', 'https://shorturl.at/jmHIh', 'https://rb.gy/ral34i']","{'href': 'https://www.linkedin.com/company/gattaca-asia/', 'siteName': 'Linkedin', 'title': 'Gattaca Asia | LinkedIn', 'description': 'Gattaca Asia | 490 followers on LinkedIn.', 'image': None}"
408,https://t.me/s/GameDev_and_Tech_vacancy/646,2024-06-17 14:46:12+00:00,"Хочу поделиться открытыми вакансиями в Artstorm на наши проекты Moderwn Warships и Tank Battles 😍 https://lnkd.in/dMk2nSUT📌 Art Director (Modern Warships)📌Project Manager (Tank Battles)📌Product Analyst (Modern Warships, Tank Battles)📌Backend Developer (Modern Warships)📌Live Ops Manager (Tank Battles)📌Community Manager (Tank Battles)📌Game Designer (Modern Warships)📌Technical Artist с опытом VFX (Modern Warships) 📌Unity Developer (Modern Warships, Tank Battles)Подробное описание вакансий:https://lnkd.in/dRdKqjFN📲 Откликнуться можно мне в личку или в телеграм: @aaannaparakhnevich","['https://artstorm.com/en-US', 'https://lnkd.in/dMk2nSUT', 'https://lnkd.in/dRdKqjFN', 'https://t.me/aaannaparakhnevich']",
409,https://t.me/s/GameDev_and_Tech_vacancy/645,2024-06-17 12:15:10+00:00,"Всем привет! Я Ольга Вагнер(Фаундер и хантер геймдев - агентства HunTeam c сильной  7+ летней экспертизой в геймдеве, как инхауз, так и снаружи) Ищу: Mid+/Senior Level Designer, на большой, крутой преформящий проект в релизе.Задачи: создавать локации игровой карты от первоначального чернового макета до готовых отполированных пространств;Команда: Лид с проекта с мировым именем;Требования: владение 3DSMax и/или Blender, Unity, опыт работы с гонками и/или любыми мидкорными большими проектами с картами, понимание оптимизации под мобайл;Условия: деньги в рынке+, шикарный соц-пакет, который сейчас редко встретишь:)Присылать портфолио мне: @volllllga или на почту: ov.hunteam@gmail.com",['https://t.me/volllllga'],
410,https://t.me/s/GameDev_and_Tech_vacancy/644,2024-06-17 08:01:18+00:00,"Вакансия: Unreal Engine developer (VR)Локация работы: #УдаленкаКвалификации сотрудника: #MiddleЗанятость: Part-time, ПроектнаяОписание вакансии:Привет! Наша команда занимается созданием игры для VR-клубов: это будет многопользовательский квест с кучей головоломок. Мы ищем UE-разработчика, который сможет присоединиться к разрабатываемому проекту.Задачи:• включение в текущую разработку;• реализация механик;• интеграция интерфейсов и создание простых программных анимаций;• интеграция существующей серверной части в игру.Требования:• опыт работы в игровой индустрии от года;• наличие портфолио проектов (ссылки или видео);• навыки разработки в Unreal Engine и понимание С++, умение работать с blueprints.Будет существенным преимуществом:• наличие VR-шлема (в т.ч. для проверки игры), также возможна покупка шлема в счет выполнения работ;• опыт работы с VR-играми и оптимизацией таких проектов;Что мы предлагаем:• формат работы: проектная работа с почасовой оплатой ($10-15/час);• удаленная работа из любой точки Земли;• заключение договора.Оставить свой отклик или задать вопросы можно в телеграмм https://t.me/telnoi","['https://t.me/s/GameDev_and_Tech_vacancy?q=%23%D0%A3%D0%B4%D0%B0%D0%BB%D0%B5%D0%BD%D0%BA%D0%B0', 'https://t.me/s/GameDev_and_Tech_vacancy?q=%23Middle', 'https://t.me/telnoi']","{'href': 'https://t.me/telnoi', 'siteName': 'Telegram', 'title': 'Niki Ta', 'description': None, 'image': None}"
411,https://t.me/s/GameDev_and_Tech_vacancy/643,2024-06-15 12:26:33+00:00,"Unity Developer Middle/SeniorАмбициозный AA проект : кроссплатформенная кооперативная PvE Sandbox MMORPG. Эпичные сражения, процедурная генерация локаций, иммерсивный мир, торговля, гибкая экономика и ещё много-много крутых фичей в магическом мире котов🐱Чем предстоит заниматься:🔸Разрабатывать новый функционал и решать технические задачи.🔸Поддерживать, развивать, рефакторить существующий код проекта.🔸Верстать интерфейсы, писать модели и представления.Мы ждём от кандидата 🔸 Знание Unity. Работа со сценами и префабами. Работа с 3D объектами, материалами, Mecanim, 3D физикой, аудио, ParticleSystem, интерфейсом на UGUI.🔸 Владение алгоритмической базой. Понимание сложности алгоритмов, знание структур данных.🔸Большой опыт с C#🔸Опыт в коммерческой разработке от 3х летЧто предлагаем мы🔸3000-4000$ гросс🔸Мощную команду: профессионалы с опытом 8+ лет в gamedev.🔸Удаленно или Возможность работать в офисе в Абу-Даби (помощь в релокации) .🔸full-time, 5/2. @irinakarabukhina","['https://missionhire.tech/', 'https://t.me/irinakarabukhina']","{'href': 'https://missionhire.tech/', 'siteName': 'missionhire.tech', 'title': 'We 🧡 Mission Hire', 'description': 'Your best hiring provider', 'image': None}"
412,https://t.me/s/GameDev_and_Tech_vacancy/642,2024-06-14 15:02:08+00:00,"Коммуникационный дизайнер в отдел маркетингаУровень: #Middle, #SeniorКомпания: VK PlayФормат работы: удаленно (с территории РФ)Оформление: ГПХ (с возможным переходом в штат)Контакты: тг @viousi или рабочая почта y.shestova@vk.teamВсем привет :)Меня зовут Юля и я ищу классного коммуникационного дизайнера в активно развивающийся отдел маркетингового дизайна VK Play.Предстоящие задачи- разработка smm материалов;- дизайн маркетинговых материалов: от лендингов, до рекламных кейвижуалов;- интеграция рекламных форматов в концепцию сайта;- реализация фич, включая новые интерфейсные решения;- создание анимации лендингов для передачи на верстку;- дизайн презентаций в Figma и Power Point;Требования- отличное владение Figma;- уверенный пользователь Photoshop и Illustrator;- понимаете, как работать со спецпроектами, и знаете роль дизайна в этом процессе;- умеете работать со стоковыми материалами;- обладаете отличными навыками коммуникации, умеете разбираться в запросах заказчика;- соблюдаете сроки, обладаете навыками планирования и самоменджмента;- понимаете принципы маркетингового дизайна, композиции, цвета и типографики;Будет плюсом- знакомство с игровой индустрией и любовь к играм;- опыт оформления онлайн и офлайн ивентов;- на базовом уровне работали с анимацией для визуализации концепций;- базовое знание 3d;- знание и умение работать с медиапроектами;Прислать свое портфолио можно в тг @viousi или на рабочую почту y.shestova@vk.team","['https://t.me/s/GameDev_and_Tech_vacancy?q=%23Middle', 'https://t.me/s/GameDev_and_Tech_vacancy?q=%23Senior', 'https://team.vk.company/projects/7/', 'https://t.me/viousi']","{'href': 'https://team.vk.company/projects/7/', 'siteName': 'team.vk.company', 'title': None, 'description': 'В VK больше 200 проектов, над которыми работают свыше 15 000 человек. ВКонтакте, ОК, Дзен, Mail․ru, RuStore, VK Play — это лишь малая часть продуктов, которые ежедневно делают жизнь миллионов людей проще и интереснее.', 'image': 'https://cdn4.cdn-telegram.org/file/vu7ap2hnIDkv7VmnNI4ZolXLlbIhWNNPTfngMnAuUnvrEHWB7Z6zRfJdXJtqM-eh47Kr0SMUc_pZkbsFTdnQhMsjxAse4t2s8mi-y9kuAjfQ8p2O6aHrIIjDd6LTR4TUV1-iAO9L_OHjHTR7TiikM-ezbrhVcqocxNr-8XLYh12IQyFWn1Yu8ttpEWAoUtWVVCr-BISncq4ZRF-SSH1ueNHCBrfJysVXCGonLcqTOGXJjAY2jpv1lepgcI1b4mN4-KodyCM_wRgsNqpfRRfyn67laQmhu_k9gMh3x6eYIWDuweJorOasPhFCeMdX7oaK_Nn_tN4mb-ofM1KJQxTQQg.jpg'}"
