,url,date,content,outlinks,linkPreview
179,https://t.me/s/itjobs_nocode/1908,2024-06-05 05:00:14+00:00,"Руководитель IT-проектов#удаленкарф #middle #100kКомпания: Teamscore ЗП: от 120 000 до 150 000₽В нашей компании Руководитель проектов:— Совместно с аналитиком участвует в сборе требований к проекту, определяет его задачи, последовательность и вехи.— Определяет бюджет проекта и ресурсы.— Руководит командой проекта (архитектор, разработчики, аналитики, тестировщики).— Контролирует сроки, качество и расходование ресурсов.— Управляет рисками и изменениями.— Проверяет соответствие выполненных работ заявленным требованиям, осуществляет внутреннюю приемку работ команды.— Взаимодействует с клиентами на протяжении всего срока сотрудничества, управляет ожиданиями заказчика.Что мы ожидаем:— Опыт ведения IT-проектов от 1 года;— Обязателен технический бэкграунд - наличие высшего технического образования и/или предыдущий опыт ""работы руками"" (разработчик, специалист тех. поддержки, инженер и т.п.) ;— Опыт работы с коммерческими заказчиками.Контакты: https://t.me/gurskaya_khttps://t.me/itjobs_nocode","['https://t.me/s/itjobs_nocode?q=%23%D1%83%D0%B4%D0%B0%D0%BB%D0%B5%D0%BD%D0%BA%D0%B0%D1%80%D1%84', 'https://t.me/s/itjobs_nocode?q=%23middle', 'https://t.me/s/itjobs_nocode?q=%23100k', 'https://t.me/gurskaya_k', 'https://t.me/itjobs_nocode']",
180,https://t.me/s/hiddengurus/1757,2024-06-19 08:55:35+00:00,"​​Python DeveloperFull-time/ЗП: от 450 000 до 550 000₽Компания: CheeleeCheelee: Мобильное приложение с видеоконтентом Какие задачи тебя ждут:— Участвовать в процессе разработки от уточнения задачи и тестирования до запуска функций продукта;— Проектировать, строить и поддерживать архитектуру приложения с высокой нагрузкой;— Улучшать производительность и доступность системы;— Активно сотрудничать с менеджерами продукта и коллегами по команде;— Строить и развивать инженерную команду (поэтому обязателен опыт управления командой).Мы ждем что у тебя есть:— Уверенные знания в области проектирования и архитектуры систем;— Большой опыт работы с базами данных (запросы, миграции, оптимизация, профилирование);— Не менее 5-х лет разработки web API's (REST) на Python или другом высокоуровневом языке программирования;— Хорошее понимание цикла разработки от анализа требований и развертывания до мониторинга приложений.Желательно:— Опыт работы с Go;— Опыт работы с высоконагруженными системами;— Опыт управления командой разработки.Наш стек:— Микросервисы, чистая архитектура;— Python 3.9+, Go;— FastAPI, asyncio;— PostgreSQL, Redis, ClickHouse, MongoDB; Kafka;— AWS, Kubernetes, Docker.Мы предлагаем:— Работай, где удобно: дом, берег Бали;— Полное отсутствие бюрократии, готовность руководства слушать и слышать сотрудника;— Профессиональный и карьерный рост, включая индексации зарплаты в соответствии с квалификацией.— Команда: работа бок о бок с крутыми специалистами из IT-индустрии со всего мира, каждый из которых готов поделиться своей экспертизой;— Личностное и профессиональное развитие: наши сотрудники делятся своей экспертизой как на внутренних образовательных порталах, так и участвуют во внешних конференциях;— Крутая корпоративная культура: книжные клубы и регулярные неформальные сессии для общения между коллегами, выездные мероприятия, в том числе и за рубеж.Контакты: @DanilCheelee","['https://telegra.ph/file/df5ffdf349ccacbe7c5a6.jpg', 'https://t.me/DanilCheelee']","{'href': 'https://telegra.ph/file/df5ffdf349ccacbe7c5a6.jpg', 'siteName': None, 'title': None, 'description': None, 'image': 'https://cdn4.cdn-telegram.org/file/AG3bpZ4TULIQnOLTn3Lr7nRfFHtTS5kpdl0VGVTTHwOwTXgnbj6FnVQlq5kfCwHTBKMWUF4a9v5Vg53JayMHD52lZLc0Ju7nOzW6tdS1JKORDsQ-iRFY4jE9T3w3hCTBmv86O3Mqjijiqx3lZJx1Q8HVsSyVPn0xSpNAwCUV5edKbclGUV82FYEWUAUX-ZBBFLiSwOny-TfyUkiqMp1ry7YQYoL90KlWLg-kXwr8A8mqYciluRtnnsCDtsCACFHytpf9duSQfWCMKoH9OMKD6aQhh1hjS6BXKTyyE_K3txJEHeBiiLj3bhl5aGoxWNtd7gS9NuookV1X354Sna_vwA.jpg'}"
181,https://t.me/s/hiddengurus/1756,2024-06-13 14:44:40+00:00,"​​Frontend developer (React Native + React (Next.js)Full-time/ЗП: от 3 000 до 5 000$Компания: DevhouseDevhouse: Международная компания, которая с 2016 года создает крутые решения для стартапов Северной Европы: Норвегии, Швеции, Дании. Мы создаем продуктовые команды и помогаем стартапам пройти путь от идеи до продукта: упаковать, продумать бизнес-логику, сделать продуктовый дизайн Чего мы ожидаем:— Опыт разработки JavaScript от 3-х лет— Знание React, React Native— Приветствуется опыт нативной разработки под iOS и/или Android— Опыт Backend разработки будет большим плюсом— Понимание архитектурных паттернов проектирования— Умение писать чистый и аккуратный код, который легко поддерживать, знание последних подходов структурирования кода предлагаемых Flutter сообществом— Опыт работы с REST Api, приветствутеся опыт работы с GraphQ— Умение быстро адаптироваться в новой области знаний, умение быстро понимать предметную модель и предлагать улучшения‍Опыт работы в продуктовых стартапах - обязательноАнглийский B2+Что мы предлагаем:— Полностью удалённая работа— Участие в интересных европейских проектах— Гибкие часы работы: начинай и заканчивай, когда продуктивно тебе, а не ""с 9 до 18""— Легкую и дружественную атмосферу— Корпоративную культуру без бюрократии и духоты— Готовы растить и научить всему, что сами знаем— Бенефиты: компенсации на спорт и саморазвитиеКонтакты: @gerasimenkosveta","['https://telegra.ph/file/601cf3d82ab2aae41d183.jpg', 'https://t.me/gerasimenkosveta']","{'href': 'https://telegra.ph/file/601cf3d82ab2aae41d183.jpg', 'siteName': None, 'title': None, 'description': None, 'image': 'https://cdn4.cdn-telegram.org/file/AbhuNhddBGv9PUSF0N25saBlpskest9eiH1HA4MNZjpfWhqt8H3FLr0L0PLYxR8S-F00WNPAFaWZ9dQV8tdU-vuS9-rYJWAJWXJ7oktrYfUjlDydmvrnv3a54-X0ZDB8TRTTeXWu3XfNdENLJmT8MVuoSuGSrO1Yp2f5XKWY_aTE248l8AiEM1Jm1TaF90xl4KOGKlNdL1acnY-mc-V1qLDzdcdY8BRJiwDVuN-z1vkBNHcW80cYpfGbi1-JRrOGSHKY1ubzTXaQP0A7LBJrJXmKZ66hLo6lpktB0ypnTIB9rYddCgr_PDd11m7AAffHMbYIrbSIj5M6j_oKMgXt4g.jpg'}"
182,https://t.me/s/hiddengurus/1755,2024-06-09 10:08:46+00:00,"​​Senior ML EngineerFull-time/ЗП: от 3 000 до 6 000$Компания: Go NETGo NET — независимая programmatic платформа, которая помогает клиентам оптимизировать закупку рекламного трафика в приложениях и на веб-сайтах.Работа в Go NET — новый этап твоей карьеры в IT:Разноплановые задачи и творческий подход: AdTech сфера очень сильно зависит от ML технологий и AI, поэтому возможностей чтобы проявить себя будет кратно больше чем во многих других вертикалях бизнеса;Высокие стандарты: Работа с Highload продуктами и в команде специалистов уровня Senior и Architect.Гибкость: Возможность работать удаленно из любой точки мира, при этом у нас есть несколько офисов по всему миру, и мы поощряем желание приезжать в офисы, общаться с коллегами и помогаем строить нетворкинг.‍Основная задача: развивать ML продукты и фичи компании.‍Мы в поиске опытного инженера, которому интересно разрабатывать и валидировать предиктивные модели, способные обучаться на данных рекламных хайлоад-платформы в реальном времени.‍Чем еще предстоит заниматься:— Разрабатывать и валидировать предиктивные модели, способные обучаться на данных рекламных нашей платформы (DSP) в реальном времени (Highload);— Улучшать алгоритмы оптимизации стоимости закупки на аукционе (RTB);— Разрабатывать решения по классификации профилей, созданию Look alike моделей и развивать механизмы сбора аудиторных сегментов;— Строить антифрод системы и системы модерации.‍Идеальный кандидат для нас: будет неравнодушен к продукту, заряжен на успех, в курсе развития рынка рекламы, помогать генерировать идеи и по-родительски относиться к продукту.‍Мы хотим видеть в кандидате:— Свободное владение SQL, Python 3, понимание основ языка Go будет преимуществом;— Широкий опыт использования моделей машинного обучения;— Опыт работы с PostgreSQL и Clickhouse;— Знание высшей математики на уровне понимания используемых технологий;— Опыт использования библиотек TensorFlow / PyTorch, Pandas, Scikit-learn;— Опыт работы с CatBoost, Airflow и системами обработки данных (Kafka, Spark и др);— Плюсом будет опыт построения нейронных сетей в задачах обработки последовательностей.🛠️ Технический стек проекта включает в себя Go, Docker, CI/CD, Prometheus, Grafana, ELK, ClickHouse, Aerospike, Redis, PostgreSQL и Kafka.Бенефиты:— Полная удаленка или релокация в гео присутствия компании;— Комфортная ЗП: возможность получать в валюте;— Квартальные бонусы за достижение индивидуальных карьерных целей;— Возможность влиять на работу востребованного хайлоад продукта от гипотезы до реализации;— Возможность получить акции нашей компании;— Индивидуальные планы развития: участие в ИТ конференциях, митапах, хакатонах, а также обучение за счет компании;— Бенефит-кафе: ДМС, техника, английский, спорт, психолог и т.п.;— Поощрение инициатив и легкий процесс внедрения идей.Контакты: @linatalents","['https://telegra.ph/file/fb592708bee94c523c60c.jpg', 'https://t.me/linatalents']","{'href': 'https://telegra.ph/file/fb592708bee94c523c60c.jpg', 'siteName': None, 'title': None, 'description': None, 'image': 'https://cdn4.cdn-telegram.org/file/M974CpofUrceT9wL9L9DSiG47qS7TZJHDdvJaUce3M32L2wydZVfEwFq_i1Sc3IZPVYn4yYM1oODIq4bf9ipFw8rHEIw5u1XkofViRiy1SNfjgl-LtL5AMebtGpgtEd_KHUf6ThzDl7Ay1Zk8FZGukdgh41zTiAsR9uFxtgQedPL2tUsdpH0IjUybZWpra3sRGtBUwSjwHLl_SIXsJ6VmzFF1QwnXHJeqsxu2KFqEgrdGH8xsBiahlevxjUcOYEqMDKhjRrerKIrMzseSvbrczK0R8PUGhz0ADvxlpmQ3B5uwCBrJLjxgB_6AxY8p9_MimVDljY490b-c7X0urDWhQ.jpg'}"
183,https://t.me/s/hiddengurus/1754,2024-06-08 11:44:32+00:00,"Представьте: компания мечты присылает вам приглашение. Как не впасть в панику и успешно подготовиться к интервью? Привет! Меня зовут Мария, я курирую HR-направление в IT-компаниях с 2016 года. И я знаю все секреты, которые помогут вам получить заветный оффер 👋 В своём канале я показываю, как устроен мир HR со стороны нанимателей. Делюсь рабочими кейсами и лайфхаками, которые будут полезны для тех, кто хочет перейти в IT или уже это сделал. Пишу здесь ✍🏼https://t.me/KemenovaHR",['https://t.me/KemenovaHR'],"{'href': 'https://t.me/KemenovaHR', 'siteName': 'Telegram', 'title': 'HR Kemenova Mariya', 'description': 'Заметки HR специалиста. Вопросы советы и предложения - @kemenovamariya', 'image': None}"
184,https://t.me/s/hiddengurus/1753,2024-06-07 07:49:58+00:00,"​​PHP DeveloperFull-time/ЗП: от 3 000$Компания: MarfatechМы глобальная международная IT-компания Marfatech, ищем PHP-разработчика.Разрабатываем высоконагруженную игровую платформу, меняем индустрию безбюрократии и легаси с большой свободой и минимумом рутины!‍Наша задача - дать мобильным приложениям новых пользователей и расширить географию. Наши потенциальные клиенты - более 2 000 000 приложений в AppStore и Google Play. Мы уже работаем с такими гигантами как : Get Taxi, Delivery Club,Coca Cola, ABBYY и многими другими. Проводим активную экспансию намеждународном рынке и выводим в свет наши новые продукты.Стек: PHP 8, Symfony 5, Golang, Mysql, Clickhouse, Redis.Обязанности/задачи:- Проектировать, разрабатывать и поддерживать серверные приложения- Активно участвовать в развитии highload-платформы- Писать чистый код- Писать тестыПредлагаем:- Удаленную работу из любой точки мира, либо офис из нескольких стран на выбор- Для офисной работы кухню с оплаченными завтраками, обедами, разнообразием фруктов/снеков и напитков;- Достойный уровень заработной платы и разный формат оплаты в том числе в валюте;- Сильную команду с инженерами из Яндекс, VK, Сбер;- Сложные задачи и использование новых технологий;- Полное отсутствие бюрократии и технологическую свободу;- Прозрачный карьерный рост;- Профессиональное развитие (конференции, литература);- Оформление возможно как по ТК РФ, так и другие варианты для удаленных сотрудников;- ДМС;- 50% компенсация оплаты изучения английского языка;- 10 бесплатных сессий и 50% компенсация оплаты консультаций психолога;- Корпоративные и спортивные мероприятия.График работы: по ТК РФ пять дней в неделю (гибкое начало дня) + возможность удаленного или гибридного графика;Отпуск 28 календарных дней;Требования к кандидатам:- Знание ООП, PHP, MySQL;- Уверенное владение паттернами проектирования;- Опыт работы с известными PHP-фреймворками;- Опыт работы с Docker и Kubernetes;- Опыт использования ОС Linux (работа в shell).Дополнительным плюсом будет:- Опыт работы с Symfony- Опыт работы в highload-проектах;Контакты: @viktoria_kolina","['https://telegra.ph/file/3a68d8840c2c8622bb7b1.jpg', 'https://t.me/viktoria_kolina']","{'href': 'https://telegra.ph/file/3a68d8840c2c8622bb7b1.jpg', 'siteName': None, 'title': None, 'description': None, 'image': 'https://cdn4.cdn-telegram.org/file/n8HoB9y1mJRzrw-VP4sDP7oe1E93uQs_ZF4Wh-GFHeMSs8j8-6sCakDLWIwwCIAJNSKSPlJkg4FjKZDe5PWbNZLABZONbPlCq5ESFLdLU_3pAePy8rPyJlnCiTl7qFP8LgWMxS445qyq2hfx6t4QTiFOoxAtQ3XjrnTGTZtEZwWZLQOT1yf6QWZwadf7DjIxC_-dvw_Xcj2hvY6PV6mhMTFAKg_41K_8EgQ1SNbsWlzFEmYQYbftBbH4o0Zhd6arfY28rJxbsc8Ld-DzuEuMWhzRYU-ol2hMlndi2Th0cJXRYtUaljl7AWKyaz2UTh-cpPpRfL-IIrPTgw00Luwjgg.jpg'}"
